{
  "$schema": "https://json-schema.org/draft/2020-12/schema",
  "$id": "https://github.com/CristianAjavi/ethical-hacker-squad/findings.schema.json",
  "title": "Ethical Hacker Squad findings artifact",
  "description": "The machine-readable half of a deliverable. The markdown report is what a person reads; this is what a pipeline can check, diff between engagements and score. Enumerations are NOT repeated here: status, severity, confidence and verification are validated against the declared regions of references/vocabulary.md, which is their single home.",
  "type": "object",
  "required": [
    "schema_version",
    "engagement",
    "findings"
  ],
  "additionalProperties": false,
  "properties": {
    "schema_version": {
      "type": "string",
      "const": "ehs.findings/v1"
    },
    "engagement": {
      "type": "object",
      "required": [
        "scope",
        "mode",
        "language",
        "generated_by"
      ],
      "additionalProperties": false,
      "properties": {
        "scope": {
          "type": "string",
          "description": "The exact path, repository or authorized target the squad was pointed at."
        },
        "commit": {
          "type": "string",
          "description": "Commit or version of the target, when it has one."
        },
        "mode": {
          "type": "string",
          "enum": [
            "audit",
            "harden",
            "verify"
          ]
        },
        "language": {
          "type": "string",
          "description": "The language the findings are written in. Identifiers are never translated."
        },
        "generated_by": {
          "type": "string",
          "description": "The skill and version that produced this file."
        },
        "coverage_declaration": {
          "type": "string",
          "description": "What was exercised and what was not, in the words of references/traceability.md."
        },
        "authorization": {
          "type": "string",
          "description": "Reference to the authorization under which remote or active tests were run, when any were."
        },
        "coverage": {
          "type": "object",
          "description": "The inventory, resolved. Every surface named in `inventoried` must appear in exactly one of `read` or `not_read`. A blinded reader test found a report that inventoried a data-access layer, routed to it, and then resolved it as neither - and concluded that silence about SQL injection in that report was not evidence of its absence. Prose could not stop that; this can.",
          "required": [
            "inventoried",
            "read",
            "not_read"
          ],
          "additionalProperties": false,
          "properties": {
            "inventoried": {
              "type": "array",
              "items": {
                "type": "string"
              },
              "minItems": 1,
              "description": "Every surface the inventory turned up, named as the reader would name it."
            },
            "read": {
              "type": "array",
              "items": {
                "type": "string"
              },
              "description": "Surfaces actually examined. A finding here is possible; its absence means clean."
            },
            "not_read": {
              "type": "array",
              "items": {
                "type": "string"
              },
              "description": "Surfaces deliberately not examined. Silence about these is silence, not a clean bill."
            }
          }
        },
        "unaided_pass": {
          "type": "object",
          "description": "What this reviewer would have reported with no corpus at all, written down BEFORE any pack was opened, and then resolved. Measured cause: across eleven runs the corpus arm found the same defects as an unaided engineer and no more, missed one the unaided arm found while having the right file open, and agreed with itself LESS across repeated runs (0.68 against 0.81). The reading those numbers support is that the corpus was substituting for judgement rather than adding to it - what a procedure names got found, what it did not name got bent into the nearest procedure or dropped. This field makes the substitution impossible to perform silently: a candidate that existed before the pack was opened must end up reported or explicitly dropped with a reason, and never merely absent.",
          "required": [
            "candidates",
            "reported",
            "dropped"
          ],
          "additionalProperties": false,
          "properties": {
            "candidates": {
              "type": "array",
              "items": {
                "type": "string"
              },
              "description": "Short labels for everything the reviewer judged worth reporting from its own reading, before loading a pack. Empty is a legitimate answer on a small target and must still be stated."
            },
            "reported": {
              "type": "array",
              "items": {
                "type": "string"
              },
              "description": "Candidates that became findings. Each label here must be carried by some finding's `unaided_label`, so the claim is checkable against the findings themselves."
            },
            "dropped": {
              "type": "array",
              "items": {
                "type": "object",
                "required": [
                  "label",
                  "reason"
                ],
                "additionalProperties": false,
                "properties": {
                  "label": {
                    "type": "string"
                  },
                  "reason": {
                    "type": "string",
                    "minLength": 1,
                    "description": "Why the second look overturned the first. `the pack has no procedure for it` is not a reason to drop a finding - that is the case `ad-hoc` exists for."
                  }
                }
              },
              "description": "Candidates deliberately not reported, each with the reason the later reading overturned the earlier one."
            }
          }
        }
      }
    },
    "findings": {
      "type": "array",
      "items": {
        "type": "object",
        "required": [
          "id",
          "title",
          "procedure",
          "status",
          "severity",
          "confidence",
          "location",
          "evidence",
          "impact",
          "recommendation",
          "traceability",
          "triage"
        ],
        "additionalProperties": false,
        "properties": {
          "id": {
            "type": "string",
            "pattern": "^F-[0-9]{3}$"
          },
          "title": {
            "type": "string",
            "minLength": 8
          },
          "procedure": {
            "type": "string",
            "description": "The pack procedure that produced it, or `ad-hoc` when none applies."
          },
          "status": {
            "type": "string",
            "description": "From vocabulary.md. `candidate` may never appear in a deliverable."
          },
          "severity": {
            "type": "string",
            "description": "From vocabulary.md, judged in this system rather than copied from a tool."
          },
          "confidence": {
            "type": "string",
            "description": "From vocabulary.md."
          },
          "location": {
            "type": "object",
            "required": [
              "path"
            ],
            "additionalProperties": false,
            "properties": {
              "path": {
                "type": "string"
              },
              "line": {
                "type": "integer",
                "minimum": 1
              },
              "component": {
                "type": "string"
              }
            }
          },
          "evidence": {
            "type": "string",
            "description": "The minimal trace or reproduction, already redacted. Placeholders only: [REDACTED:secret], [REDACTED:pii], [REDACTED:internal-host], [REDACTED:payload]."
          },
          "impact": {
            "type": "string"
          },
          "preconditions": {
            "type": "string"
          },
          "recommendation": {
            "type": "string"
          },
          "verification": {
            "type": "string",
            "description": "From vocabulary.md, when a fix was verified."
          },
          "inference": {
            "type": "string",
            "description": "Required for `probable`: the one link that was inferred rather than observed."
          },
          "withdrawn_reason": {
            "type": "string",
            "description": "Required for `withdrawn`: why a claim already made did not survive."
          },
          "traceability": {
            "type": "array",
            "minItems": 1,
            "items": {
              "type": "string"
            }
          },
          "triage": {
            "type": "array",
            "minItems": 1,
            "items": {
              "type": "object",
              "required": [
                "rule",
                "answer"
              ],
              "additionalProperties": false,
              "properties": {
                "rule": {
                  "type": "string",
                  "pattern": "^FP-[0-9]{2}$"
                },
                "answer": {
                  "type": "string",
                  "enum": [
                    "HOLDS",
                    "DOES_NOT_HOLD",
                    "UNKNOWN",
                    "NOT_APPLICABLE"
                  ]
                },
                "reason": {
                  "type": "string",
                  "description": "Required whenever the answer is not DOES_NOT_HOLD: the artifact that supports it."
                }
              }
            }
          },
          "limits": {
            "type": "string"
          },
          "what_would_settle_it": {
            "type": "string",
            "description": "Required for `probable`: the artifact, file or symbol that would turn the inference into an observation. A gap named without a way to close it sends the reader nowhere."
          },
          "unaided_label": {
            "type": "string",
            "description": "The label this finding carried in `engagement.unaided_pass.candidates`, when it originated there rather than from a procedure. It is the join that lets a validator prove nothing found before the pack was opened went missing after."
          }
        }
      }
    },
    "ruled_out": {
      "type": "array",
      "description": "What was tested and did not appear, and what actively resisted. The section a client almost never receives.",
      "items": {
        "type": "object",
        "required": [
          "class",
          "procedure",
          "outcome",
          "where"
        ],
        "additionalProperties": false,
        "properties": {
          "class": {
            "type": "string"
          },
          "procedure": {
            "type": "string"
          },
          "outcome": {
            "type": "string",
            "description": "From the verification vocabulary: refuted, inconclusive, not executed or blocked."
          },
          "where": {
            "type": "string",
            "description": "What was exercised and how far it reached. A bound, not a claim about the whole system."
          }
        }
      }
    }
  }
}
