{
  "schema_version": "ehs.findings/v1",
  "engagement": {
    "scope": "/private/tmp/claude-501/-Users-cristianajavi/ddae72cd-6c1e-4c0c-be51-8f91cd87d164/scratchpad/t2/target",
    "mode": "audit",
    "language": "en",
    "generated_by": "ethical-hacker-squad/1.0",
    "coverage": {
      "inventoried": [
        "HTTP routes with Express (routes/invoices.js)",
        "JWT authentication (lib/auth.js)",
        "Database queries (lib/db.js)",
        "Remote HTTP requests (lib/remote.js)",
        "HTML rendering (lib/render.js)",
        "Node.js dependencies (package.json)"
      ],
      "read": [],
      "not_read": []
    },
    "unaided_pass": {
      "candidates": [
        "SQL injection in /invoices route (ORDER BY)",
        "SSRF in /branding/preview endpoint (fetchLogo)",
        "JWT signature verification missing (critical auth bypass)",
        "XSS in invoiceNote function (missing escapeHtml)",
        "Potential object-level authorization weakness in /receipts"
      ],
      "reported": [],
      "dropped": []
    }
  },
  "findings": [],
  "ruled_out": []
}
